{
  "success": true,
  "score": 1.0,
  "grade": "A",
  "metrics": [
    {
      "name": "completeness",
      "score": 1.0,
      "weight": 1.4,
      "notes": []
    },
    {
      "name": "clarity",
      "score": 1.0,
      "weight": 1.0,
      "notes": []
    },
    {
      "name": "actionability",
      "score": 1.0,
      "weight": 1.2,
      "notes": []
    },
    {
      "name": "traceability",
      "score": 1.0,
      "weight": 1.0,
      "notes": []
    },
    {
      "name": "error_awareness",
      "score": 1.0,
      "weight": 0.7,
      "notes": [
        "metadata confirms error check"
      ]
    }
  ],
  "recommendations": [],
  "validation": {
    "success": true,
    "issues": [],
    "metadata": {
      "validator": "HandoffStateValidator"
    }
  },
  "metadata": {
    "handoffs": 1,
    "evaluator": "HandoffQualityEvaluator"
  }
}